{
  "$schema": "../deck.schema.json",
  "name": "Sirella's Spellstorm",
  "format": "commander",
  "theme": "Izzet spellslinger — chain cheap instants and sorceries to grow a prowess crew, loot toward your best spells, and close with evasive, spell-fueled threats.",
  "description": "A casual, precon-level Commander deck. Sirella rewards a low curve packed with noncreature spells: every spell pumps your board through prowess, and casting two a turn loots you deeper into the deck. Built to a legal 100 — 37 lands, 10 ramp, 12 draw, 12 interaction, 3 board wipes, 13 threats, and 12 spellslinger payoffs behind the commander.",
  "colorIdentity": ["U", "R"],
  "commander": ["Sirella, the Stormcoil"],
  "bracket": 2,
  "cards": [
    { "name": "Sirella, the Stormcoil", "role": "Commander", "note": "Prowess + loot-on-second-spell payoff that ties the deck together." },

    { "name": "Embercoil Drake", "role": "Threat", "note": "Evasive beater that loots on combat damage and pumps itself." },
    { "name": "Stormwing Roc", "role": "Threat" },
    { "name": "Cinderfin Marauder", "role": "Threat" },
    { "name": "Tidehunter Leviathan", "role": "Threat", "note": "Cheaper the more spells you've cast; hard to gang-block." },
    { "name": "Voltaic Phoenix", "role": "Threat", "note": "Recurs itself off your second spell each turn." },
    { "name": "Spellscale Drake", "role": "Threat" },
    { "name": "Maelstrom Djinn", "role": "Threat" },
    { "name": "Riftstalker Weird", "role": "Threat", "note": "Power scales with instants/sorceries in your graveyard." },
    { "name": "Emberwake Elemental", "role": "Threat" },
    { "name": "Galecrest Sentinel", "role": "Threat" },
    { "name": "Stormcaller Adept", "role": "Threat" },
    { "name": "Thundercoil Serpent", "role": "Threat" },
    { "name": "Arclight Marauder", "role": "Threat" },

    { "name": "Coil in the Deep", "role": "Interaction", "note": "Soft counter that also smooths draws with scry." },
    { "name": "Emberlash", "role": "Interaction", "note": "Cheap removal / reach that triggers prowess." },
    { "name": "Dissolving Tide", "role": "Interaction" },
    { "name": "Voltaic Rebuke", "role": "Interaction" },
    { "name": "Searing Riposte", "role": "Interaction" },
    { "name": "Stormbolt", "role": "Interaction" },
    { "name": "Tideturn", "role": "Interaction" },
    { "name": "Galefront Snap", "role": "Interaction" },
    { "name": "Cindersnap", "role": "Interaction" },
    { "name": "Mindlash Pulse", "role": "Interaction" },
    { "name": "Riftarc Bolt", "role": "Interaction" },
    { "name": "Undertow Grasp", "role": "Interaction" },

    { "name": "Stormread Augury", "role": "Draw" },
    { "name": "Cinder Divination", "role": "Draw" },
    { "name": "Coil of Whispers", "role": "Draw" },
    { "name": "Galethink Vision", "role": "Draw" },
    { "name": "Pyric Insight", "role": "Draw" },
    { "name": "Tidecaller's Ledger", "role": "Draw" },
    { "name": "Echo of the Maelstrom", "role": "Draw" },
    { "name": "Sparkscribe Adept", "role": "Draw" },
    { "name": "Ember Oracle", "role": "Draw" },
    { "name": "Voltaic Epiphany", "role": "Draw" },
    { "name": "Riftpage Recall", "role": "Draw" },
    { "name": "Stormsong Codex", "role": "Draw" },

    { "name": "Voltaic Lodestone", "role": "Ramp" },
    { "name": "Stormforged Cog", "role": "Ramp" },
    { "name": "Coilspring Talisman", "role": "Ramp" },
    { "name": "Kindled Offering", "role": "Ramp" },
    { "name": "Galvanic Reservoir", "role": "Ramp" },
    { "name": "Embertide Channeling", "role": "Ramp" },
    { "name": "Spellbacked Idol", "role": "Ramp" },
    { "name": "Tempo Lens", "role": "Ramp" },
    { "name": "Surge Capacitor", "role": "Ramp" },
    { "name": "Arc Familiar", "role": "Ramp" },

    { "name": "Stormcoil Ascendancy", "role": "Payoff", "note": "Makes a hasty Elemental for every instant/sorcery." },
    { "name": "Maelstrom Mentor", "role": "Payoff" },
    { "name": "Pyroscribe Savant", "role": "Payoff" },
    { "name": "Echoing Surge", "role": "Payoff" },
    { "name": "Tidecoil Channeler", "role": "Payoff", "note": "Copies your second spell each turn." },
    { "name": "Spellweaver's Crown", "role": "Payoff" },
    { "name": "Galvanic Resonance", "role": "Payoff" },
    { "name": "Embermind Prodigy", "role": "Payoff" },
    { "name": "Arcflare Adept", "role": "Payoff" },
    { "name": "Coilbound Familiar", "role": "Payoff" },
    { "name": "Spellsurge Totem", "role": "Payoff" },
    { "name": "Maelstrom Crescendo", "role": "Payoff", "note": "Refills off a graveyard full of spells." },

    { "name": "Cinderwave", "role": "Board Wipe" },
    { "name": "Tide's Reclamation", "role": "Board Wipe" },
    { "name": "Pyroclastic Surge", "role": "Board Wipe", "note": "Spares your fliers." },

    { "name": "Stormcoil Delta", "role": "Land" },
    { "name": "Voltaic Estuary", "role": "Land" },
    { "name": "Tideflare Reef", "role": "Land" },
    { "name": "Emberglass Spire", "role": "Land" },
    { "name": "Sparkwake Channel", "role": "Land" },
    { "name": "Mizzium Conflux", "role": "Land" },
    { "name": "Cinderfall Archive", "role": "Land" },
    { "name": "Thunderhead Atoll", "role": "Land" },
    { "name": "Runescry Vault", "role": "Land" },
    { "name": "Galethrum Causeway", "role": "Land" },
    { "name": "Pyreflux Mirror", "role": "Land" },
    { "name": "Hauntide Drift", "role": "Land" },
    { "name": "Island", "role": "Land", "count": 13 },
    { "name": "Mountain", "role": "Land", "count": 12 }
  ],
  "plan": {
    "size": 100,
    "lands": 37,
    "ramp": 10,
    "draw": 12,
    "interaction": 12,
    "boardWipes": 3,
    "threats": 13,
    "payoff": 12
  }
}
